index,page_title,campus,block_release_duration,distance_learning_duration,full_time_duration,part_time_duration,block_release_international_fees,distance_learning_international_fees,full_time_international_fees,part_time_international_fees,block_release_uk_fees,distance_learning_uk_fees,full_time_uk_fees,part_time_uk_fees,block_release_url,distance_learning_url,full_time_url,part_time_url,desc_len,description,ai_description,desc_ai_len
0,"AI, Data and Communication MA","Harrow, North-West London",,,1 year,2 years,,,"£17,500","£1,985",,,"£9,700","£1,125",,,https://www.westminster.ac.uk/computer-science-and-engineering-data-science-and-informatics-media-and-communication-courses/2025-26/september/full-time/ai-data-and-communication-ma,https://www.westminster.ac.uk/computer-science-and-engineering-data-science-and-informatics-media-and-communication-courses/2025-26/september/part-time-day-evening/ai-data-and-communication-ma,242,"It is estimated that there will be 97 million data-related jobs by 2025, and many of these will require employees with strong analytical and communication skills who are able to connect data with the needs of an ever-growing range of sectors."," Introducing a cutting-edge educational course tailored for the future workforce. By 2025, an astounding 97 million jobs in data analysis are projected to emerge, many of which necessitate individuals proficient in both analytical skills and effective communication. This innovative program equips students with the ability to bridge the gap between raw data and diverse industry sectors' needs, fostering a unique blend of tech-savvy expertise and adaptable problem-solvers. The course covers comprehensive data handling, strategic analysis, and persuasive storytelling – empowering graduates to thrive in this rapidly expanding field. Embrace the opportunity to become a vital link between the data revolution and the ever-evolving needs of tomorrow's industries.",275
1,Accounting BSc Honours,"Marylebone, Central London",,,3 or 4 years,,,,"£17,000",,,,"£9,250",,,,https://www.westminster.ac.uk/accounting-and-finance-courses/2025-26/september/full-time/accounting-bsc-honours,,414,"Our innovative accounting course is designed to address the ever-changing needs of the accounting industry. There's a strong demand for specialised accountants across a diverse range of organisations, from multinational corporations and regional firms to government agencies and international businesses of all sizes. This professionally accredited degree equips you with a comprehensive understanding of business."," This innovative accounting course is meticulously crafted to meet the dynamic demands of the rapidly evolving accounting sector. The program boasts high demand for its specialized graduates, who are sought after by a diverse array of organizations, including multinational corporations, regional firms, government agencies, and international businesses of all sizes. This professionally accredited degree empowers students with a thorough comprehension of business fundamentals, ensuring they graduate as competent professionals well-prepared to excel in the dynamic world of accounting.",275
2,Accounting and Business Management BA Honours,"Marylebone, Central London",,,3 or 4 years,,,,"£17,000",,,,"£9,250",,,,https://www.westminster.ac.uk/accounting-and-finance-business-and-management-courses/2025-26/september/full-time/accounting-and-business-management-ba-honours,,615,"This degree is designed to equip you with a unique set of accounting and managerial skills to analyse and evaluate company and industry trends. You’ll learn how to receive, interpret and communicate financial and other information in a globalised profession. Gaining a deeper understanding of how finances affect company performance, you’ll be better placed to help firms make effective business decisions. Upon completion of the degree, students will be eligible to apply for eight CIMA (Chartered Institute of Management Accountants) exemptions and up to six ACCA (Association of Chartered Certified Accountants)."," This innovative degree program offers a blend of accounting and management skills, arming you with the ability to discern and appraise company and industry trends in the global business landscape. The curriculum emphasizes decoding and communicating financial data effectively within a worldwide profession. By delving deeper into the impact of finances on corporate performance, you'll be well-positioned to guide firms towards informed decision-making. Upon successful completion, students are eligible to apply for up to eight CIMA (Chartered Institute of Management Accountants) exemptions and six ACCA (Association of Chartered Certified Accountants) certifications, providing a strong foundation for a career in the dynamic world of finance.",275
3,Air Transport Planning and Management MSc,"Marylebone, Central London",2 years,,1 year,,"£1,785",,"£15,500",,"£1,125",,"£9,700",,https://www.westminster.ac.uk/transport-and-logistics-courses/2025-26/september/block-release/air-transport-planning-and-management-msc,,https://www.westminster.ac.uk/transport-and-logistics-courses/2025-26/september/full-time/air-transport-planning-and-management-msc,,521,"This course has been developed to meet the needs of graduates worldwide seeking to gain greater knowledge and experience of the air transport industry, and looking to progress into senior roles in management, operations and commercial planning of airlines, airports, government departments and aviation-related businesses such as aircraft manufacturing, finance and consultancy. It is designed to provide a strong theoretical and analytical basis, coupled with the application of many practical techniques and strategies."," This innovative educational course caters to global graduates aiming to deepen their understanding and expand their experience within the air transport industry. The program focuses on equipping individuals for senior management, operations, and commercial planning roles in airlines, airports, government departments, and aviation-related sectors like aircraft manufacturing, finance, and consultancy. The course offers a robust theoretical and analytical foundation, complemented by hands-on practical techniques and strategic applications. This comprehensive approach ensures graduates are well-prepared for successful careers in the dynamic and complex world of air transport.",275
4,Animation BA Honours,"Harrow, North-West London",,,3 or 4 years,,,,"£17,000",,,,"£9,250",,,,https://www.westminster.ac.uk/art-design-and-visual-culture-film-and-television-media-and-communication-courses/2025-26/september/full-time/animation-ba-honours,,204,"Our exciting specialist course will enable you to develop your imaginative and creative skills, while giving you a sound knowledge and understanding of animation processes, techniques and critical theory."," This engaging specialist course nurtures both your imaginative and creative flair, while providing a solid foundation on the intricacies of animation production. You'll delve deep into various animation techniques, critical theories, and essential processes that form the backbone of this captivating art form. By the end of the course, you'll not only have honed your artistic abilities but also developed a profound understanding of the theories that drive animation. So, immerse yourself in this dynamic learning experience, designed to turn your creative visions into stunning animations.",275
5,Animation with Foundation BA Honours,"Harrow, North-West London",,,4 or 5 years,,,,"£17,000",,,,"£9,250",,,,https://www.westminster.ac.uk/art-design-and-visual-culture-film-and-television-media-and-communication-courses/2025-26/september/full-time/animation-with-foundation-ba-honours,,176,Our degree courses with Foundation year offer the opportunity to prepare you for advanced study before you progress onto a full honours degree at the University of Westminster.," The University of Westminster's degree courses with a Foundation year provide a unique pathway, preparing students for advanced studies in various disciplines. This Foundation year serves as a stepping stone towards pursuing a full honors degree, catering to those who might need additional academic preparation. These comprehensive programs offer the perfect blend of subject-specific knowledge and skills development, ensuring a smooth transition into higher education. By choosing this route, students can confidently embark on their academic journey at the University of Westminster, fostering intellectual growth and opening doors to a myriad of opportunities in their chosen field.",275
6,Applied Biomedical Science BSc Honours,"Cavendish, Central London",,,,4 years,,,,"£2,830",,,,"£1,540",,,,https://www.westminster.ac.uk/biological-and-biomedical-sciences-courses/2025-26/september/part-time-day-release/applied-biomedical-science-bsc-honours,421,"Our Applied Biomedical Science BSc offers an integrated approach to the study of human health and disease, with an emphasis on the diagnosis and understanding of disease processes from a medical diagnostic perspective. This course is only open to you if you are employed in a suitable accredited biomedical laboratory able to support work-based learning, and you'll need a written statement of support from your employer."," In the realm of human health, our Applied Biomedical Science BSc program presents an innovative, integrated approach that focuses on the intricate aspects of human disease diagnosis and understanding, particularly from a medical diagnostic perspective. To join this dynamic learning journey, you must be employed in a recognized biomedical laboratory that fosters work-based learning, and your application requires a formal statement of support from your employer. This unique, employment-oriented course prepares you to unravel the complexities of disease processes, empowering you with invaluable skills for a successful career in the field.",275
7,Applied Biotechnology MSc,"Cavendish, Central London",,,1 year,,,,"£17,600",,,,"£10,700",,,,https://www.westminster.ac.uk/biological-and-biomedical-sciences-courses/2025-26/september/full-time/applied-biotechnology-msc,,424,"Our Applied Biotechnology MSc includes a wide range of modern molecular biology techniques and explores how biotechnology can be used by today's society. It is an established course in biotechnology which has been extensively updated. You'll complement your theoretical studies with hands-on experience of fully controlled fermenters that are up to pilot-plant scale, and are linked to modern monitoring and control systems."," The Applied Biotechnology MSc offers a comprehensive exploration of contemporary molecular biology techniques, emphasizing their application in today's society. This established course in biotechnology has been meticulously updated, providing students with a blend of theoretical knowledge and practical experience. Key highlights include hands-on sessions with advanced fermenters, scaling up to pilot plant level, integrated with cutting-edge monitoring and control systems. This unique blend of theory and practice equips students with the skills necessary to navigate the dynamic field of biotechnology.",275
8,Arabic and English BA Honours,"Regent, Central London",,,3 or 4 years,5 years,,,"£17,000","£2,830",,,"£9,250","£1,540",,,https://www.westminster.ac.uk/english-and-creative-writing-languages-courses/2025-26/september/full-time/arabic-and-english-ba-honours,https://www.westminster.ac.uk/languages-courses/2025-26/september/part-time-day/arabic-and-english-ba-honours,116,"At Westminster, we'll train you to become a competent linguist and communicator, ready to enter graduate employment."," In the vibrant learning environment at Westminster, you will be equipped with the skills to excel as a multilingual professional. Our comprehensive course is designed to transform you into a fluent, versatile linguist. Emphasizing practical communication, we ensure you're fully prepared to navigate the complexities of diverse linguistic landscapes. By integrating theoretical knowledge with real-world applications, our program prepares you for graduate employment, fostering your potential as a competent communicator in your chosen field. Whether you're aiming for global business or diplomacy, our course empowers you to thrive in an interconnected world.",275
9,Arabic and International Business BA Honours,"Regent, Central London",,,3 or 4 years,,,,"£17,000",,,,"£9,250",,,,https://www.westminster.ac.uk/business-and-management-languages-courses/2025-26/september/full-time/arabic-and-international-business-ba-honours,,151,Our Arabic and International Business BA will help you develop the skills and knowledge you'll need to succeed in the internationalised business world.," Embark on an enriching journey with our Arabic and International Business Bachelor of Arts program, designed to equip students with the essential tools for thriving in today's globalized corporate landscape. This innovative course combines a deep understanding of the Arabic language and culture with cutting-edge international business practices. Students will gain proficiency in Arabic while exploring key areas such as marketing, finance, human resources, and strategic management within an international context. By learning to navigate diverse business environments, you'll be well-prepared for a career that transcends borders, fostering cross-cultural understanding and promoting sustainable business practices worldwide. Whether your aspirations lie in multinational corporations, entrepreneurship, or public service, this program provides a solid foundation for success in the internationalized business world.",275
10,Arabic and International Communication BA Honours,"Regent, Central London",,,3 or 4 years,,,,"£17,000",,,,"£9,250",,,,https://www.westminster.ac.uk/languages-courses/2025-26/september/full-time/arabic-and-international-communication-ba-honours,,185,"Our Arabic and International Communication BA develops your knowledge of the Arabic language and culture, and develops your communication skills for the professional global environment."," The ""Arabic and International Communication"" BA program provides a comprehensive education, combining linguistic proficiency in Arabic with expertise in cross-cultural communication. This course equips students with in-depth knowledge of the rich Arabic language and its intricate cultural nuances, while simultaneously honing their skills to navigate the global professional landscape. The program's unique blend of these two critical areas prepares learners to effectively communicate across international boundaries, making them valuable assets for today's interconnected world.",275
11,Arabic and International Communication with Foundation BA Honours,"Regent, Central London",,,4 or 5 years,,,,"£17,000",,,,"£9,250",,,,https://www.westminster.ac.uk/languages-courses/2025-26/september/full-time/arabic-and-international-communication-with-foundation-ba-honours,,176,Our degree courses with Foundation year offer the opportunity to prepare you for advanced study before you progress onto a full honours degree at the University of Westminster.," The University of Westminster's degree courses equipped with a Foundation year serve as a preparatory step towards advanced studies, ensuring seamless transition into a full honours degree. This unique setup is tailored to support students who may require additional academic preparation before diving headfirst into their chosen field of study. By offering comprehensive educational groundwork within this Foundation year, the university empowers students with the necessary skills and knowledge to excel in their future studies. This innovative approach fosters a strong foundation for students' academic journey at the University of Westminster.",275
12,Arabic and International Relations BA Honours,"Regent, Central London",,,3 or 4 years,5 years,,,"£17,000","£2,830",,,"£9,250","£1,540",,,https://www.westminster.ac.uk/languages-politics-and-international-relations-courses/2025-26/september/full-time/arabic-and-international-relations-ba-honours,https://www.westminster.ac.uk/languages-politics-and-international-relations-courses/2025-26/september/part-time-day/arabic-and-international-relations-ba-honours,187,"Our Arabic and International Relations course focuses on questions of governance, democracy and human rights, while training competent Arabic linguists ready to enter graduate employment."," This Arabic and International Relations course delves into pivotal topics such as governance, democracy, and human rights, within the context of the Arab world. By combining linguistic proficiency with global politics insights, this program prepares students for competitive graduate positions. The curriculum equips learners with both a strong command of the Arabic language and an understanding of complex regional issues, making them uniquely positioned to engage in diplomacy or analysis related to the Middle East. This course not only fosters linguistic excellence but also nurtures well-rounded professionals poised to contribute to a globalized world where Arabic fluency and international relations expertise are highly sought after.",275
13,Arabic and Linguistics BA Honours,"Regent, Central London",,,3 or 4 years,5 years,,,"£17,000","£2,830",,,"£9,250","£1,540",,,https://www.westminster.ac.uk/languages-courses/2025-26/september/full-time/arabic-and-linguistics-ba-honours,https://www.westminster.ac.uk/languages-courses/2025-26/september/part-time-day/arabic-and-linguistics-ba-honours,103,Our Arabic and Linguistics BA trains you to be a competent linguist ready to enter graduate employment.," This Arabic and Linguistics Bachelor's Degree program equips students with the essential skills to become proficient linguists, priming them for successful careers in graduate employment. Through comprehensive coursework, students delve into Arabic language mastery, while simultaneously exploring linguistic theories and methodologies. The curriculum emphasizes practical application, fostering a deep understanding of both spoken and written Arabic dialects. Moreover, the program equips students with critical thinking skills, enabling them to analyze complex linguistic issues effectively. Students also gain valuable cultural insights through the study of Arabic literature and history, providing a holistic education in Arabic language and linguistics. By graduation, students are well-prepared to tackle diverse challenges in the linguistics field, making them highly sought after by graduate employers.",275
14,Architectural Technology BSc Honours,"Marylebone, Central London",,,3 or 4 years,,,,"£17,000",,,,"£9,250",,,,https://www.westminster.ac.uk/architecture-interiors-and-urban-design-courses/2025-26/september/full-time/architectural-technology-bsc-honours,,126,Our design-led Architectural Technology BSc will give you the skills you need to launch your career in design and development.," In this Design-Led Architectural Technology BSc program, students acquire essential skills to embark on a successful career in design and construction. This comprehensive course focuses on blending artistic creativity with technological proficiency, equipping learners with both design-led principles and architectural technology knowledge. The curriculum includes subjects such as building design, materials science, environmental impact analysis, and digital modeling. Graduates will be well-equipped to tackle complex design projects while considering sustainability and accessibility aspects. By the end of this program, students will have a strong foundation in architectural technology, enabling them to contribute significantly to the dynamic field of design and development.",275
15,Architectural Technology with Foundation BSc Honours,"Marylebone, Central London",,,4 or 5 years,,,,"£17,000",,,,"£9,250",,,,https://www.westminster.ac.uk/architecture-interiors-and-urban-design-courses/2025-26/september/full-time/architectural-technology-with-foundation-bsc-honours,,176,Our degree courses with Foundation year offer the opportunity to prepare you for advanced study before you progress onto a full honours degree at the University of Westminster.," The University of Westminster's degree courses with a Foundation year provide an exceptional pathway for students seeking a solid foundation for advanced studies. This innovative program prepares learners for full honours degrees, offering a seamless transition into undergraduate study. By bridging academic and cultural gaps, this program ensures students are well-prepared to succeed in their future academic endeavors. The Foundation year focuses on developing essential skills, building confidence, and fostering an inclusive environment that encourages success. This unique opportunity combines a strong foundation with the prestige of a University of Westminster education, making it an ideal choice for students seeking a comprehensive university experience.",275
16,Architecture & Sustainable Heritage MA,"Marylebone, Central London",,,1 year,2 years,,,"£15,500","£1,785",,,"£9,700","£1,125",,,https://www.westminster.ac.uk/architecture-interiors-and-urban-design-courses/2025-26/september/full-time/architecture-sustainable-heritage-ma,https://www.westminster.ac.uk/architecture-interiors-and-urban-design-courses/2025-26/september/part-time-day/architecture-sustainable-heritage-ma,266,The Architecture and Sustainable Heritage MA offers a distinctive programme for those interested in studying the historic built environment. The course provides a unique platform for students to advance careers in heritage practice or engage in specialised research.," This Architecture and Sustainable Heritage MA program is tailored for individuals passionate about preserving historical architectural wonders. It offers a rare opportunity for career advancement within heritage practice, or for those seeking to delve deeper into specialized research. The course uniquely blends the study of historic built environments with sustainable practices, creating a dynamic platform that equips students with essential skills for navigating the intricate world of architectural conservation and innovation. By enrolling in this program, students will not only gain practical knowledge but also contribute to the preservation and enhancement of our cultural heritage, ensuring its continuity for future generations.",275
17,Architecture BA Honours,"Marylebone, Central London",,,3 or 4 years,,,,"£17,000",,,,"£9,250",,,,https://www.westminster.ac.uk/architecture-interiors-and-urban-design-courses/2025-26/september/full-time/architecture-ba-honours,,225,"Architecture is a fascinating subject involving wide-ranging academic, practical and vocational activities. It requires creativity and imagination, as well as the inventive employment of environmental and technical knowledge."," In this engaging exploration of architecture, students delve into a captivating blend of theoretical and hands-on experiences. The course emphasizes the importance of creativity and imaginative thinking in architectural design, while concurrently instilling a deep understanding of environmental and technical knowledge. From drafting blueprints to constructing models, this comprehensive program encourages learners to apply their innovative ideas in practical settings. By combining academic rigor with vocational skills, this course offers a well-rounded, immersive journey into the dynamic world of architecture.",275
