index,page_title,campus,block_release_duration,distance_learning_duration,full_time_duration,part_time_duration,block_release_international_fees,distance_learning_international_fees,full_time_international_fees,part_time_international_fees,block_release_uk_fees,distance_learning_uk_fees,full_time_uk_fees,part_time_uk_fees,block_release_url,distance_learning_url,full_time_url,part_time_url,desc_len,description,ai_description,desc_ai_len
129,Financial Economics BSc Honours,"Marylebone, Central London",,,3 or 4 years,,,,"£17,000",,,,"£9,250",,,,https://www.westminster.ac.uk/economics-courses/2025-26/september/full-time/financial-economics-bsc-honours,,290,"Financial economics is all about managing financial assets such as trade and share prices, interest rates and exchange rates. You’ll not only be introduced to financial economics, but also gain a solid foundation in general economic concepts, principles, analysis, techniques and knowledge."," Delve into the fascinating world of Financial Economics, where you'll master the art of managing financial assets like trade and share prices, interest rates, and exchange rates. This captivating course provides an initial introduction to financial economics while laying a robust foundation in core economic principles. From analyzing market trends to employing practical techniques for data-driven decision making, this program offers an immersive journey through the intricacies of finance and its impact on the global economy. Whether you're a budding economist or aiming to elevate your financial acumen, this comprehensive course promises to enrich your understanding of the ever-evolving financial landscape.",275
130,Fine Art Mixed Media BA Honours,"Harrow, North-West London",,,3 or 4 years,4 years,,,"£17,000","£2,830",,,"£9,250","£1,540",,,https://www.westminster.ac.uk/art-design-and-visual-culture-courses/2025-26/september/full-time/fine-art-mixed-media-ba-honours,https://www.westminster.ac.uk/art-design-and-visual-culture-courses/2025-26/september/part-time-day/fine-art-mixed-media-ba-honours,176,"Our innovative Fine Art Mixed Media BA will give you the opportunity to explore and develop work across boundaries, within the ever-expanding contemporary fine art disciplines."," Embark on a creative journey with our cutting-edge Fine Art Mixed Media BA! This program invites you to traverse artistic borders, delving into diverse realms of modern fine art. You'll be encouraged to push boundaries and innovate within this dynamic field. The curriculum is designed to foster your growth as an artist, offering a rich blend of traditional techniques and contemporary approaches. Explore various mediums, from painting and sculpture to digital art and installation, all while developing your unique artistic voice. This immersive experience provides a platform for you to thrive in the ever-evolving landscape of fine art.",275
131,Fine Art Mixed Media with Foundation BA Honours,"Harrow, North-West London",,,4 years,,,,"£17,000",,,,"£9,250",,,,https://www.westminster.ac.uk/art-design-and-visual-culture-courses/2025-26/september/full-time/fine-art-mixed-media-with-foundation-ba-honours,,176,Our degree courses with Foundation year offer the opportunity to prepare you for advanced study before you progress onto a full honours degree at the University of Westminster.," The University of Westminster's degree courses, equipped with a Foundation year, provide a pathway for students to ready themselves for rigorous higher-level education. This preparatory phase eases the transition into a comprehensive, full honours degree. By enrolling in this program, students can confidently embark on their academic journey, knowing they are well-prepared for the intellectual challenges that lie ahead at the University of Westminster. This structure ensures a smooth and successful educational experience for those aiming to excel in their chosen field.",275
132,French and English BA Honours,"Regent, Central London",,,3 or 4 years,5 years,,,"£17,000","£2,830",,,"£9,250","£1,540",,,https://www.westminster.ac.uk/english-and-creative-writing-languages-courses/2025-26/september/full-time/french-and-english-ba-honours,https://www.westminster.ac.uk/languages-courses/2025-26/september/part-time-day/french-and-english-ba-honours,116,"At Westminster, we'll train you to become a competent linguist and communicator, ready to enter graduate employment."," In the dynamic landscape of global communication at Westminster, aspiring linguists and communicators embark on an immersive educational journey. This course equips students with robust language skills, preparing them for successful graduate employment. The comprehensive curriculum encompasses not only linguistic proficiency but also effective communication strategies, ensuring a well-rounded competency. Students engage in practical exercises, fostering their ability to navigate diverse cultural contexts and communicate effectively across borders. Westminster's commitment to nurturing professionals who excel in the realm of language and communication equips its graduates with the skills necessary for success in today's interconnected world.",275
133,French and International Business BA Honours,"Regent, Central London",,,3 or 4 years,,,,"£17,000",,,,"£9,250",,,,https://www.westminster.ac.uk/business-and-management-languages-courses/2025-26/september/full-time/french-and-international-business-ba-honours,,151,Our French and International Business BA will help you develop the skills and knowledge you'll need to succeed in the internationalised business world.," Embrace a globally-focused career path with our Bachelor of Arts in French and International Business! This innovative program equips students with essential language skills, cultural competencies, and business acumen necessary for thriving in today's interconnected marketplaces. By blending intensive French language courses with comprehensive international business curriculum, you'll master the art of cross-cultural communication and navigate complex global trade practices confidently. Additionally, study abroad opportunities offer firsthand experience in French-speaking business environments, ensuring a well-rounded education that prepares you for success on the world stage. Join us and embark on an exciting journey towards a fulfilling career in international business with a unique language advantage!",275
134,French and International Communication BA Honours,"Regent, Central London",,,3 or 4 years,,,,"£17,000",,,,"£9,250",,,,https://www.westminster.ac.uk/languages-courses/2025-26/september/full-time/french-and-international-communication-ba-honours,,186,"Our French and International Communication BA develops your knowledge of the French language and culture,  and develops your communication skills for the professional global environment."," This French and International Communication Bachelor's Degree program offers an immersive exploration into the intricacies of the French language and cultural context. By mastering this versatile tongue, you will expand your linguistic repertoire while delving deeper into understanding diverse perspectives. Beyond language acquisition, this course equips you with advanced communication skills tailored for the global professional sphere. You'll gain expertise in international relations, cross-cultural competencies, and strategic multilingual communication - all essential tools for thriving in today's interconnected world. This comprehensive program will empower you to confidently navigate the challenges of an increasingly globalized society and seize opportunities in the ever-evolving international landscape.",275
135,French and International Communication with Foundation BA Honours,"Regent, Central London",,,4 or 5 years,,,,"£17,000",,,,"£9,250",,,,https://www.westminster.ac.uk/languages-courses/2025-26/september/full-time/french-and-international-communication-with-foundation-ba-honours,,176,Our degree courses with Foundation year offer the opportunity to prepare you for advanced study before you progress onto a full honours degree at the University of Westminster.," The University of Westminster's degree courses with a Foundation year provide a unique pathway, tailored to equip students effectively for higher-level studies. This innovative approach offers a solid grounding in essential academic skills and subject knowledge before transitioning into a full honours degree program. By embracing this opportunity, aspiring students can confidently navigate the challenges of advanced study, ensuring they thrive in their academic journey at the esteemed University of Westminster.",275
136,French and International Relations BA Honours,"Regent, Central London",,,3 or 4 years,5 years,,,"£17,000","£2,830",,,"£9,250","£1,540",,,https://www.westminster.ac.uk/languages-politics-and-international-relations-courses/2025-26/september/full-time/french-and-international-relations-ba-honours,https://www.westminster.ac.uk/languages-politics-and-international-relations-courses/2025-26/september/part-time-day/french-and-international-relations-ba-honours,187,"Our French and International Relations course focuses on questions of governance, democracy and human rights, while training competent French linguists ready to enter graduate employment."," This innovative French and International Relations course delves into the intricate realms of governance, democracy, and human rights, equipping students with a deep understanding of these topics in a global context. Simultaneously, it meticulously cultivates proficiency in the French language, transforming learners into competent linguists. The course's ultimate goal is to prepare students for successful careers post-graduation by offering a unique blend of theoretical knowledge and practical language skills. This fusion makes this program an ideal choice for those aspiring to navigate the multifaceted world of international relations with finesse, all while mastering the elegant French language.",275
137,French and Linguistics BA Honours,"Regent, Central London",,,3 or 4 years,5 years,,,"£17,000","£2,830",,,"£9,250","£1,540",,,https://www.westminster.ac.uk/languages-courses/2025-26/september/full-time/french-and-linguistics-ba-honours,https://www.westminster.ac.uk/languages-courses/2025-26/september/part-time-day/french-and-linguistics-ba-honours,103,Our French and Linguistics BA trains you to be a competent linguist ready to enter graduate employment.," This French and Linguistics Bachelor's Degree program equips students with the essential skills to excel as proficient linguists, priming them for competitive graduate-level careers. By combining the study of French language and linguistic theory, this comprehensive course immerses students in the intricacies of both conversational fluency and the scientific analysis of languages. The curriculum encompasses phonetics, morphology, syntax, semantics, pragmatics, sociolinguistics, and discourse analysis. Additionally, students engage in extensive language practice, refining their speaking, listening, reading, and writing skills in French. By graduation, students are well-versed in both theoretical linguistics and practical application of the French language, making them highly sought-after candidates in the job market for positions related to translation, interpretation, teaching, or research in linguistics and French studies.",275
138,Games Art BA Honours,"Harrow, North-West London",,,3 or 4 years,,,,"£17,000",,,,"£9,250",,,,https://www.westminster.ac.uk/art-design-and-visual-culture-courses/2025-26/september/full-time/games-art-ba-honours,,405,"The Games Art BA will provide you with the creative skills and technical knowledge needed to design visual assets in game environments; you’ll design the characters, objects and backgrounds that make games come to life. This course will prepare you to become a confident games artist who can create visuals and user experience design applicable across a wide range of industries and emerging technologies."," The Games Art BA offers an immersive learning experience, equipping students with both creative flair and technical prowess. Through this program, you'll hone your skills in designing characters, objects, and backdrops, breathing life into dynamic game environments. This comprehensive course aims to foster confident games artists capable of creating visually stunning assets and user experiences adaptable across various industries and cutting-edge technologies. By the end of this engaging journey, you'll be ready to pioneer the visual landscape of interactive entertainment.",275
139,Global Challenges BA Honours,"Regent, Central London",,,3 or 4 years,,,,"£17,000",,,,"£9,250",,,,https://www.westminster.ac.uk/politics-and-international-relations-courses/2025-26/september/full-time/global-challenges-ba-honours,,282,"Our Global Challenges BA will help you to address some of the most pressing political, scientific and ethical challenges facing humanity globally today. You’ll explore some of the key dimensions of science, politics and society, working towards creating and leading positive change."," Embark on a transformative journey with our Global Challenges Bachelor's Degree, addressing urgent political, scientific, and ethical issues shaping the world today. This program offers an immersive exploration into the intricate realms of science, politics, and society, empowering you to catalyze change for a better tomorrow. With a focus on creating and leading positive global transformation, this degree equips students with invaluable skills and knowledge needed to tackle pressing worldwide concerns head-on. This unique educational experience provides an unparalleled opportunity to contribute meaningfully to the future of humanity.",275
140,Global Contemporary Art MA,"Harrow, North-West London",,,1 year,2 years,,,"£15,500","£1,785",,,"£11,700","£1,325",,,https://www.westminster.ac.uk/art-design-and-visual-culture-courses/2025-26/september/full-time/global-contemporary-art-ma,https://www.westminster.ac.uk/art-design-and-visual-culture-courses/2025-26/september/part-time-day/global-contemporary-art-ma,231,"The Global Contemporary Art MA is a practice-led course designed to nurture the professional, critical, and collaborative skills needed to pursue impactful, globally-aware and socially responsible artistic and curatorial practices."," Embark on the Global Contemporary Art MA, a dynamic educational journey that cultivates proficient, discerning, and collaborative skills for successful, globally-informed, and socially conscious art practice or curation. This practice-oriented course encourages students to engage in impactful artistic endeavors, fostering an awareness of cultural nuances and promoting a responsible global outlook.",275
141,Global Criminology MA,"Regent, Central London",,,1 year,2 years,,,"£17,500","£8,750",,,"£10,700","£5,350",,,https://www.westminster.ac.uk/criminology-and-sociology-courses/2025-26/september/full-time/global-criminology-ma,https://www.westminster.ac.uk/criminology-and-sociology-courses/2025-26/september/part-time-day/global-criminology-ma,293,"The Global Criminology MA is designed to develop your knowledge and critical understanding of criminology as an interdisciplinary subject that incorporates legal, political and psychological, as well as social scientific approaches to the study of crime, deviance, criminal and social justice."," Embark on the Global Criminology MA journey, a comprehensive program that delves into the intricate intersection of law, politics, psychology, and sociology in the analysis of crime and deviance. This course offers an enriching exploration of criminology from a global perspective, emphasizing social justice and criminal justice systems. Students will acquire valuable skills in critical thinking, research methodologies, and policy analysis. By embracing diverse theoretical frameworks, this program equips learners with the tools to navigate the complexities of crime and its impacts on society, both locally and globally. This unique educational experience promises a transformative journey for those eager to make a tangible difference in the world of criminal justice and social welfare.",275
142,Global Development MA,"Regent, Central London",,,1 year,2 years,,,"£17,500","£8,750",,,"£10,700","£5,350",,,https://www.westminster.ac.uk/politics-and-international-relations-courses/2025-26/september/full-time/global-development-ma,https://www.westminster.ac.uk/politics-and-international-relations-courses/2025-26/september/part-time-day/global-development-ma,174,"The Global Development MA offers you an interdisciplinary, practical, skill-based training to become an engaged, ethical development thinker and practitioner upon graduation."," The Global Development MA provides a comprehensive, applied learning experience, transforming students into ethically minded development professionals. This interdisciplinary program blends theoretical knowledge with practical skills, ensuring a well-rounded education in global development. By the end of this course, students will be equipped with the tools necessary to make meaningful contributions to the field, becoming active participants in shaping a more equitable world. Key aspects include real-world case studies, collaborative projects, and opportunities for international fieldwork, enhancing your practical understanding of global development issues. Whether you're new to the field or seeking to advance your career, this program offers a unique blend of academic rigor and hands-on experience, setting you up for success in the dynamic world of global development.",275
143,Global Media MA,"Harrow, North-West London",,,1 year,2 years,,,"£17,500","£1,985",,,"£9,700","£1,125",,,https://www.westminster.ac.uk/media-and-communication-courses/2025-26/september/full-time/global-media-ma,https://www.westminster.ac.uk/media-and-communication-courses/2025-26/september/part-time-day/global-media-ma,329,"From Al Jazeera to Hollywood, from Disney to China Central TV, Amazon, Alphabet/Google, Netflix, Alibaba and Tencent, the media increasingly operate in a global context. This course offers a comprehensive interdisciplinary approach to global media, and is designed for those who work in, or want to work in, the media industries."," Titled ""Global Media Perspectives,"" this enriching educational program delves into the intricate world of international media landscapes. From Al Jazeera to Hollywood, and extending to Disney, China Central TV, Amazon, Google, Netflix, Alibaba, and Tencent, this course explores the dynamic global media arena where these titans operate. This interdisciplinary course is tailored for individuals currently employed or aspiring to work within media industries. It equips students with invaluable insights into the complexities of global media markets, empowering them to navigate and succeed in this ever-evolving field.",275
144,Global Public Health Nutrition MSc,"Cavendish, Central London",,,1 year,2 years,,,"£17,500","£1,750",,,"£10,700","£1,070",,,https://www.westminster.ac.uk/nutrition-and-public-health-courses/2025-26/september/full-time/global-public-health-nutrition-msc,https://www.westminster.ac.uk/nutrition-and-public-health-courses/2025-26/september/part-time-day/global-public-health-nutrition-msc,200,Our Global Public Health Nutrition MSc will give you the specialist scientific knowledge and practical skills to take an active role in global public health nutrition in a range of different settings.," Embark on the Global Public Health Nutrition MSc, a comprehensive course tailored for aspiring professionals aiming to impact global health. This specialized Master's program equips students with advanced scientific knowledge and hands-on skills essential for addressing nutritional challenges worldwide. Engage in diverse practical applications across various settings, fostering your ability to contribute effectively to the field of public health nutrition on a global scale.",275
145,Global Public Health with Data Science MSc,"Cavendish, Central London",,,1 year,2 years,,,"£17,500","£8,750",,,"£10,700","£5,350",,,https://www.westminster.ac.uk/nutrition-and-public-health-courses/2025-26/september/full-time/global-public-health-with-data-science-msc,https://www.westminster.ac.uk/nutrition-and-public-health-courses/2025-26/september/part-time-day/global-public-health-with-data-science-msc,362,"The Global Public Health with Data Science MSc is a unique course bringing new insights to public health. As we enter a new era of healthcare, combining global public health with data science can support decision making, advance evidence-based policies and drive strategies in combating diseases by analysing data on omics, health, lifestyle and the environment."," In the evolving landscape of healthcare, the Global Public Health with Data Science MSc offers a distinctive educational path. By merging public health knowledge with data science skills, this course empowers students to make informed decisions, develop evidence-based policies, and strategize against diseases through sophisticated data analysis. The program focuses on analyzing omics, health, lifestyle, and environmental data, thereby providing crucial insights into global public health issues. This cutting-edge program is poised to be a game-changer in the field, leveraging the power of data science for effective disease combatant strategies.",275
146,Global Trade and Business BA Honours,"Marylebone, Central London",,,1 year,,,,"£17,000",,,,"£9,250",,,,https://www.westminster.ac.uk/business-and-management-economics-courses/2025-26/september/full-time/global-trade-and-business-ba-honours,,273,Are there any winners in an international trade war? Are large trade deficits a problem? What are the challenges for businesses that wish to start exporting their products? You’ll tackle these questions and more on our exciting ‘top-up’ degree in Global Trade and Business.," Delve into the intricate world of global commerce with our stimulating 'top-up' degree in Global Trade and Business! This program offers insights into the complexities of international trade wars, shedding light on whether winners truly exist amidst these conflicts. You'll also explore the implications of large trade deficits for both countries and businesses, understanding why they can pose significant challenges. Ever considered expanding your business internationally but unsure about the hurdles? This course equips you with strategies to tackle the obstacles faced by businesses venturing into exports. Join us on this enlightening journey that will empower you to navigate the dynamic landscape of global trade!",275
147,Graphic Design BA Honours,"Harrow, North-West London",,,3 or 4 years,,,,"£17,000",,,,"£9,250",,,,https://www.westminster.ac.uk/art-design-and-visual-culture-media-and-communication-courses/2025-26/september/full-time/graphic-design-ba-honours,,233,"On this course you’ll learn a broad range of creative, technical and professional skills and use these to respond to industry-standard briefs and collaborative project work – preparing you for life as a professional graphic designer."," This engaging educational course equips students with a diverse skill set, blending creativity, technology, and professionalism. By tackling industry-standard projects and collaborative assignments, learners are effectively prepared for their future roles as accomplished Graphic Designers. The curriculum ensures a comprehensive understanding of design principles, enabling students to craft compelling responses that meet real-world professional demands.",275
148,Graphic Design with Foundation BA Honours,"Harrow, North-West London",,,4 or 5 years,,,,"£17,000",,,,"£9,250",,,,https://www.westminster.ac.uk/art-design-and-visual-culture-media-and-communication-courses/2025-26/september/full-time/graphic-design-with-foundation-ba-honours,,176,Our degree courses with Foundation year offer the opportunity to prepare you for advanced study before you progress onto a full honours degree at the University of Westminster.," The University of Westminster's degree courses equipped with a Foundation year provide a unique platform for prospective students, offering preparatory education tailored for advanced studies. This Foundation year serves as a stepping stone, enabling students to seamlessly transition into a full honours degree program once prepared. This innovative approach ensures that all individuals, regardless of background, have the opportunity to pursue higher education and unlock their academic potential. The University of Westminster's comprehensive and supportive learning environment promises a rewarding educational journey for those seeking to expand their horizons and achieve academic excellence.",275
