index,page_title,campus,block_release_duration,distance_learning_duration,full_time_duration,part_time_duration,block_release_international_fees,distance_learning_international_fees,full_time_international_fees,part_time_international_fees,block_release_uk_fees,distance_learning_uk_fees,full_time_uk_fees,part_time_uk_fees,block_release_url,distance_learning_url,full_time_url,part_time_url,desc_len,description,ai_description,desc_ai_len
184,Languages and Translation with Foundation BA Honours,"Regent, Central London",,,4 years,,,,"£17,000",,,,"£9,250",,,,https://www.westminster.ac.uk/languages-courses/2025-26/september/full-time/languages-and-translation-with-foundation-ba-honours,,498,"Our degree courses with foundation year offer the opportunity to prepare you for advanced study before you progress onto a full honours degree at the University of Westminster. Whether you do not feel ready for degree-level study, don’t have the right qualifications, want to change your subject specialism or return to study after an absence from education, we aim to encourage a broad range of students to undertake our foundation year in order to progress onto their full honours degree with us."," The University of Westminster's degree courses featuring a foundation year serve as a springboard for students, enabling preparation for advanced studies before transitioning into a full honours degree. This program caters to individuals who are not fully prepared for degree-level study, lack the necessary qualifications, seek a subject change, or wish to re-enter education after a hiatus. The foundation year is designed inclusively, welcoming students from various backgrounds, fostering their progression towards a fulfilling academic journey with us.",275
185,Law LLB Honours,"Regent, Central London",,,3 or 4 years,4 years,,,"£17,000","£2,830",,,"£9,250","£1,540",,,https://www.westminster.ac.uk/law-courses/2025-26/september/full-time/law-llb-honours,https://www.westminster.ac.uk/law-courses/2025-26/september/part-time-day/law-llb-honours,438,"Studying Law at Westminster will place you on a pathway to excellence. From your first day with us, you will be encouraged to express your ideas, voice, and identity through legal endeavour. In addition to teaching core legal skills, you will study new and emerging areas of law and legal practice, to help you stay ahead. Throughout your degree, you can define your learning pathway by choosing from a large number of specialist modules."," At Westminster, embark on an extraordinary journey in Law, crafting a pathway to excellence. Embrace the chance to articulate your ideas, individuality, and perspective within legal realms from day one. Beyond mastering fundamental legal skills, you'll explore emerging fields of law and practice, ensuring you remain ahead of the curve. Throughout your degree, shape your learning experience by selecting from a diverse range of specialist modules. Your Law education at Westminster isn't just about acquiring knowledge; it's about preparing you to thrive in tomorrow's ever-evolving legal landscape.",275
186,Law and Criminal Justice LLB,"Regent, Central London",,,3 or 4 years,,,,"£17,000",,,,"£9,250",,,,https://www.westminster.ac.uk/law-courses/2025-26/september/full-time/law-and-criminal-justice-llb,,264,"Why people commit crimes, and how criminals should be dealt with, are fascinating questions which lie at the heart of a just and safe society. This course is one of very few in the UK to combine specialist teaching in criminal justice with a qualifying law degree."," ""Explore the intriguing nexus of crime, justice, and society in this unique UK course that integrates a specialised Criminal Justice education with a Qualifying Law Degree. Delve into the complexities behind criminal behavior and learn effective strategies for criminal justice systems to ensure a fair and secure environment. This course equips students with a comprehensive understanding of the 'why' and 'how' in dealing with criminals, providing an essential foundation for those aiming to contribute to a just society.""",275
187,Law and International Relations LLB,"Regent, Central London",,,3 or 4 years,,,,"£17,000",,,,"£9,250",,,,https://www.westminster.ac.uk/law-politics-and-international-relations-courses/2025-26/september/full-time/law-and-international-relations-llb,,189,Studying Law and International Relations at the University of Westminster will place you on a pathway to a meaningful career in the field of international legal practice and global affairs.," Pursue a dynamic and impactful career in international law and diplomacy by enrolling in the Law and International Relations course at the University of Westminster. This rigorous program combines the intricacies of law with the complexities of global politics, empowering students to excel in the fast-paced world of international legal practice and global affairs. Through engaging lectures, practical workshops, and insightful discussions, you will gain a comprehensive understanding of critical legal concepts, diplomatic strategies, and global policies. The program's emphasis on real-world applications ensures that you are prepared to tackle contemporary challenges, making significant contributions in your future career as an international legal professional or a leader in global affairs. Embark on this transformative journey at the University of Westminster, shaping a brighter, more equitable world one decision at a time.",275
188,Law and Technology LLM,"Regent, Central London",,,1 year,2 years,,,"£17,500","£8,750",,,"£12,700","£6,350",,,https://www.westminster.ac.uk/law-courses/2025-26/september/full-time/law-and-technology-llm,https://www.westminster.ac.uk/law-courses/2025-26/september/part-time-day/law-and-technology-llm,476,"Explore the dynamic and intricate relationship between law and technology in today’s fast-paced world with our comprehensive Law and Technology LLM programme. Examine how technological advancements reshape legal and regulatory frameworks, critically analysing their impact on society, the economy, ethics, and technology itself. Immerse yourself in captivating emerging normativities at the intersection of law and technology, essential for envisioning new regulatory futures."," Delve into the thrilling nexus of law and technology with our engaging Law and Technology LLM program. This course offers an in-depth exploration of how technological advancements redefine legal landscapes. You'll critically examine the far-reaching implications on society, the economy, ethics, and tech development itself. Dive deep into emerging normativities at the heart of this dynamic interface, crucial for imagining future regulatory scenarios. This program is tailor-made for those eager to navigate the intricate relationship between law and technology in today's rapidly evolving world.",275
189,Law with Foundation LLB Honours,"Regent, Central London",,,4 years,,,,"£17,000",,,,"£9,250",,,,https://www.westminster.ac.uk/law-courses/2025-26/september/full-time/law-with-foundation-llb-honours,,498,"Our degree courses with foundation year offer the opportunity to prepare you for advanced study before you progress onto a full honours degree at the University of Westminster. Whether you do not feel ready for degree-level study, don’t have the right qualifications, want to change your subject specialism or return to study after an absence from education, we aim to encourage a broad range of students to undertake our foundation year in order to progress onto their full honours degree with us."," The University of Westminster presents degree courses with integrated foundation years, offering a preparatory pathway for advanced learning. This program is designed to accommodate individuals who may lack readiness for degree-level study, possess inappropriate qualifications, seek a change in subject specialization, or wish to resume education after an extended hiatus. By participating in this foundation year, students can smoothly transition into their chosen full honours degree with the university, creating an inclusive and versatile learning environment that caters to diverse backgrounds and aspirations.",275
190,Law with French Law LLB Honours,"Regent, Central London",,,4 years,,,,"£17,000",,,,"£9,250",,,,https://www.westminster.ac.uk/law-courses/2025-26/september/full-time/law-with-french-law-llb-honours,,211,"Do you want to make an impact in the global legal arena while enhancing your French language skills? Speaking different languages, specifically legal ones, is a significant advantage in our interconnected world."," Embark on a transformative journey to master French in the context of global law! This unique educational course, designed for enthusiasts seeking a competitive edge, offers an immersive experience in both legal vocabulary and conversational French. By focusing on key areas like international law, business law, and human rights, you'll gain a comprehensive understanding of these subjects in French. The program emphasizes real-life scenarios, allowing you to practice your skills effectively. This course equips you with the tools needed to excel in the multilingual global legal arena, enhancing your career prospects and broadening your perspectives. Don't miss this opportunity to stand out among peers - join today!",275
191,Legal Practice LLM,"Regent, Central London",,,1 year,2 years,,,"£15,500","£7,750",,,"£14,700","£7,350",,,https://www.westminster.ac.uk/law-courses/2025-26/september/full-time/legal-practice-llm,https://www.westminster.ac.uk/law-courses/2025-26/september/part-time-evening-only/legal-practice-llm,611,"If you want to practise as a solicitor in England and Wales, the Legal Practice Course (LPC) remains a great choice if you have a Qualifying Law Degree or a Graduate Diploma in Law. After graduating from the course, you may qualify as a solicitor through the traditional route of a training contract. You now also have the option to qualify through the Solicitors Qualifying Examination pathway by claiming exemption from SQE1 and substituting qualifying work experience for a training contract – find out more about the benefits of doing a Legal Practice Course and the new route to becoming a solicitor on our"," The Legal Practice Course (LPC) offers a valuable stepping stone towards practicing as a solicitor in England and Wales, suitable for those with a Qualifying Law Degree or Graduate Diploma in Law. Upon course completion, you can qualify as a solicitor via the traditional training contract route or alternatively, through the Solicitors Qualifying Examination (SQE) pathway by claiming exemption from SQE1 and swapping qualifying work experience for a training contract. Explore the advantages of the LPC and the new avenue to solicitor-hood by delving deeper into these options on our site.",275
192,Legal Practice Postgraduate Diploma,"Regent, Central London",,,1 year,2 years,,,"£13,500","£6,500",,,"£12,700","£6,350",,,https://www.westminster.ac.uk/law-courses/2025-26/september/full-time/legal-practice-postgraduate-diploma,https://www.westminster.ac.uk/law-courses/2025-26/september/part-time-evening-only/legal-practice-postgraduate-diploma,611,"If you want to practise as a solicitor in England and Wales, the Legal Practice Course (LPC) remains a great choice if you have a Qualifying Law Degree or a Graduate Diploma in Law. After graduating from the course, you may qualify as a solicitor through the traditional route of a training contract. You now also have the option to qualify through the Solicitors Qualifying Examination pathway by claiming exemption from SQE1 and substituting qualifying work experience for a training contract – find out more about the benefits of doing a Legal Practice Course and the new route to becoming a solicitor on our"," The Legal Practice Course (LPC) is an ideal choice for those aiming to practice as solicitors in England and Wales, with either a Qualifying Law Degree or Graduate Diploma in Law. Upon completing this course, you may opt for the traditional route of a training contract to qualify as a solicitor or alternatively, pursue the Solicitors Qualifying Examination (SQE) pathway by claiming exemption from SQE1 and substituting qualifying work experience for a training contract. The LPC provides valuable insights into practical legal skills, enhancing your eligibility to practice in diverse areas of law. Explore the advantages of undertaking the Legal Practice Course and the new route to becoming a solicitor by delving deeper into its benefits on our platform.",275
193,Logistics and Supply Chain Management MSc,"Marylebone, Central London",,,1 year,2 years,,,"£17,500","£1,985",,,"£10,700","£1,225",,,https://www.westminster.ac.uk/transport-and-logistics-courses/2025-26/september/full-time/logistics-and-supply-chain-management-msc,https://www.westminster.ac.uk/transport-and-logistics-courses/2025-26/september/part-time-day/logistics-and-supply-chain-management-msc,310,The Logistics and Supply Chain Management MSc has been designed to develop your ability to carry out advanced analysis and research in the field of logistics and supply chain management within a global context. The MSc course has been running since 1998 and is offered by the School of Architecture and Cities.," This Logistics and Supply Chain Management MSc, a prestigious program with roots dating back to 1998, offers advanced analysis and research opportunities within a global context, all under the guidance of the esteemed School of Architecture and Cities. Designed for those eager to excel in logistics, this course equips students with essential skills to navigate the complexities of modern supply chain management on a global scale. The program's longevity is testament to its relevance and effectiveness, making it an ideal choice for professionals seeking to bolster their expertise in this dynamic field.",275
194,Management MA,"Marylebone, Central London",,,1 year,,,,"£17,500",,,,"£16,700",,,,https://www.westminster.ac.uk/business-and-management-courses/2025-26/september/full-time/management-ma,,559,"Core management skills are in high demand in our rapidly changing environment. Successful managers need to know how people behave, the nature of leadership and sources of power and influence within the workplace. They must also plan, prioritise, develop new processes and identify new opportunities. That’s why our MA provides a broad understanding of business – from finance and people management to operations, communications and marketing. You’ll graduate with the all-round expertise and decision-making capabilities required to lead modern organisations."," This Master's degree focuses on equipping students with essential core management skills for thriving in today's dynamic business landscape. The program emphasizes understanding human behavior, effective leadership, and power dynamics within organizations. Key competencies include strategic planning, prioritization, process development, and opportunity identification. The curriculum offers a comprehensive business education, covering areas such as finance, people management, operations, communications, and marketing. By the end of this course, graduates will possess the well-rounded expertise and decisive abilities necessary to steer contemporary organizations towards success.",275
195,Marketing Communications MA/MSc,"Marylebone, Central London",,,1 year,,,,"£19,500",,,,"£16,700",,,,https://www.westminster.ac.uk/business-and-management-marketing-courses/2025-26/september/full-time/marketing-communications-ma-msc,,507,"Incorporating the latest digital and analytic marketing practices, the broad curriculum of our Master’s degree reflects the rapidly changing global marketing environment. Whilst at Westminster, you can also secure two internationally-recognised professional qualifications – the Institute of Data and Marketing (IDM) Certificate in Digital Marketing and the Institute of Practitioners in Advertising (IPA) Global Foundation Certificate, as well as joining the Chartered Institute of Public Relations (CIPR)."," This Master's degree at Westminster immerses students in a dynamic, cutting-edge curriculum tailored to today's evolving global marketing landscape. The program emphasizes the latest digital and analytic marketing strategies, preparing students for success in an increasingly data-driven world. Notably, students can simultaneously earn two prestigious professional certifications: the Institute of Data and Marketing (IDM) Certificate in Digital Marketing and the Institute of Practitioners in Advertising (IPA) Global Foundation Certificate. Additionally, students have the opportunity to join the Chartered Institute of Public Relations (CIPR), broadening their network within the marketing field. This comprehensive program equips students with a robust skill set, ready to excel in tomorrow's digital-first marketing environment.",275
196,Marketing Communications with AI Integration BA Honours,"Marylebone, Central London",,,3 or 4 years,,,,"£17,000",,,,"£9,250",,,,https://www.westminster.ac.uk/business-and-management-marketing-courses/2025-26/september/full-time/marketing-communications-with-ai-integration-ba-honours,,488,"The expansion of new media technologies and sophisticated customer profiling – covering everything from media consumption to recreational preferences – have increased the choice and importance of creative decisions in marketing strategy. Developed with input from current ‘marcomms’ practitioners, our professionally-focused degree will equip you with the creative and specialist knowledge, skills and capabilities to select the right media channels and craft the most effective messages."," This innovative, professional degree course is tailored to the dynamic landscape of modern marketing, emphasizing the influence of expanding new media technologies and customer profiling. By blending creative decision-making strategies with specialist knowledge, this program equips students with the necessary skills to effectively navigate various media channels and craft compelling messages. This course, informed by input from current 'marcomms' practitioners, promises a comprehensive education designed for those aiming to excel in today's marketing world.",275
197,Marketing Management BA Honours,"Marylebone, Central London",,,3 or 4 years,,,,"£17,000",,,,"£9,250",,,,https://www.westminster.ac.uk/business-and-management-marketing-courses/2025-26/september/full-time/marketing-management-ba-honours,,391,"Marketing lies at the heart of every successful business. By engaging with and understanding the customer’s needs, marketing managers influence the development of products and services, providing advice on the best point of sale and recommending the most competitive price. They identify and make sure the target market knows what’s on offer – in increasingly more creative and dynamic ways."," This innovative educational course delves into the world of marketing, a crucial aspect of any thriving business. Students will learn to decipher customer needs, thereby influencing product development and suggesting optimal pricing and sales strategies. The focus is on developing creative and dynamic approaches to market offerings, ensuring a strong market presence. Key skills in this field include identifying target markets, strategizing effective communication, and leveraging these insights to build a competitive edge. Ultimately, this course equips students with the tools to navigate the dynamic landscape of modern marketing.",275
198,Marketing Management MA/MSc,"Marylebone, Central London",,,1 year,,,,"£19,500",,,,"£16,700",,,,https://www.westminster.ac.uk/business-and-management-marketing-courses/2025-26/september/full-time/marketing-management-ma-msc,,389,"In today’s fast-paced global business environment, strategic marketing influences every aspect of business, informing decisions about how to create and maintain consumer demand, increase profit, build reputation and stay ahead of the competition. Incorporating the latest digital and analytic marketing practices, our Master’s reflects the ever-changing nature of this exciting profession."," This innovative Master's program delves into the dynamic world of strategic marketing, equipping students with the skills to navigate the swiftly evolving global business landscape. The course emphasizes understanding and shaping consumer demand, maximizing profitability, enhancing corporate reputation, and outsmarting competitors - all fundamental aspects in today's competitive marketplace. By blending cutting-edge digital and analytical marketing techniques, this program reflects the industry's ongoing transformation, ensuring graduates are well-prepared for success.",275
199,Marketing and Data Analytics BSc Honours,"Marylebone, Central London",,,3 or 4 years,,,,"£17,000",,,,"£9,250",,,,https://www.westminster.ac.uk/marketing-courses/2025-26/september/full-time/marketing-and-data-analytics-bsc-honours,,427,"In the dynamic world of decision-making, our Marketing and Data Analytics BSc prepares you for success in the surging field of marketing data and analytics. You’ll gain essential skills in collecting, analysing and interpreting marketing data with cutting-edge tools and techniques. Delve into crafting influential marketing strategies, covering crucial aspects like consumer insight, user experience, and strategy development."," In the rapidly evolving landscape of marketing, our Marketing and Data Analytics BSc program equips you with the necessary skills to thrive in the burgeoning field of data-driven marketing. This course focuses on empowering students with proficiency in gathering, analyzing, and interpreting marketing data using advanced tools and methodologies. You'll traverse the intricate world of marketing strategies, gaining insights into consumer behavior, user experience optimization, and strategic development. This comprehensive program offers a unique blend of theoretical knowledge and practical applications, ensuring you are well-prepared to seize opportunities in today's data-driven marketing industry.",275
200,Master of Architecture (MArch) (RIBA pt II),"Marylebone, Central London",,,2 years,,,,"£15,500",,,,"£9,700",,,,https://www.westminster.ac.uk/architecture-interiors-and-urban-design-courses/2025-26/september/full-time/master-of-architecture-march-riba-pt-ii,,439,"The Master of Architecture (MArch) (RIBA pt II) is a long-established and well-respected course that is prescribed by the Architects Registration Board (ARB) and validated by the Royal Institute of British Architects (RIBA) to give exemption from the second stage of professional education. The emphasis of the course is on innovative design work, and on developing a caring and critical approach to the study and practice of architecture."," The Master of Architecture (MArch) (RIBA pt II) is a distinguished and accredited educational program recognized by the Architects Registration Board (ARB) and the Royal Institute of British Architects (RIBA). This course, renowned for its innovative design focus, aims to equip students with a thoughtful and critical perspective towards architecture. By successfully completing this program, students are granted exemption from the second stage of professional education. The curriculum emphasizes nurturing creativity in design work while fostering compassion and critique within the field of architecture, ultimately preparing graduates for successful careers in the dynamic world of architecture.",275
201,Master of Business Administration (MBA),"Marylebone, Central London",,,1 year,,,,"£19,500",,,,"£16,700",,,,https://www.westminster.ac.uk/business-and-management-courses/2025-26/september/full-time/master-of-business-administration-mba,,248,Our innovative Westminster MBA is designed for ambitious business professionals – and recent graduates from any discipline – who don’t want to wait until they have extensive work experience before taking the first steps towards a management career.," The Westminster MBA offers an exceptional opportunity for ambitious individuals, regardless of their undergraduate background, to commence their management careers promptly. This innovative program is specifically tailored for professionals seeking a headstart in leadership roles without relying on years of work experience. By enrolling in this course, students gain access to cutting-edge business knowledge and skills, empowering them to seize opportunities in today's dynamic global market. The Westminster MBA equips aspiring leaders with the essential tools needed for success, transforming them into strategic thinkers equipped to navigate complex business landscapes. This is an unparalleled stepping stone for individuals eager to accelerate their career growth and make a tangible impact in the world of business.",275
